CLIENTE;TEL 1;TEL 2;CEL 1;CEL 2;CEL 3;CUPO;CONTRATO;CIUDAD;CONCESIONARIO;ASESOR;COD VENDEDOR;COD ASESOR;C. PAGAS;C. MORA;CuotasSeleccion
ARIAS URANGO GERARDO;;;3215398652;;;;12-861328;CERETE (CORD);COUNTRY MOTORS S.A. (M);;;;36.56;0;36.56
VILLADIEGO MONTES LILIANA;;;3107479049;;;;12-964659;SOLEDAD (ATLA);COUNTRY MOTOR S.A 3;;;;26;0;26
MU?OZ AYALA JOSE MANUEL;;;3107272559;;;;12-202468;SOLEDAD (ATLA);AUTOMOTORES DEL LITORAL S.A.53;;;;36.27;0;36.27
PALACIO CLAUDIA MILENA;;;3183635641;;;;12-941293;BARRANQUILLA (ATLA);AUTOLITORAL MIRAMAR;;;;28;0;28
TOCA ORTIZ CARLOS MARIO;;;#N/A;;;;12-967475;#N/A;VEHICOSTA S.A.S;;;;30.32;0;30.32
FORERO ROZO JOSE ALBERTO;;;3114443234;;;;12-503518;BARRANQUILLA (ATLA);COUNTRY MOTORS S.A. CL 77;;;;20.28;0;20.28
